{"$schema":"https://json-schema.org/draft/2020-12/schema","$id":"https://omt-global.github.io/axiom/schemas/axiom.provider-abi.v1.schema.json","type":"object","additionalProperties":false,"required":["schema_version","contract","issue","negotiation","safe_surface","handles","buffers","operations","errors","loading","audit","fixtures"],"properties":{"schema_version":{"const":"axiom.provider-abi.v1"},"contract":{"const":"runtime.provider_abi"},"issue":{"const":1453},"negotiation":{"type":"object"},"safe_surface":{"type":"object"},"handles":{"type":"object"},"buffers":{"type":"object"},"operations":{"type":"object"},"errors":{"type":"object"},"loading":{"type":"object"},"audit":{"type":"object"},"fixtures":{"type":"array"}}}
