{"schema_version":"axiom.provider-abi.v1","contract":"runtime.provider_abi","issue":1453,"negotiation":{"entrypoint":"axiom_provider_v1","version":{"major":1,"minor":"provider_lte_runtime"},"features":"declared_unique_subset","required_symbols":["describe","call","release_owned_buffer","close_handle"],"incompatible":"fail_closed_before_call"},"safe_surface":{"exports":["provider_descriptor","opaque_handle_u64","owned_bytes","borrowed_bytes","owned_text_utf8","borrowed_text_utf8","structured_error","cancellation_token"],"forbidden":["raw_pointer","address","allocator_callback","retained_callback","unbounded_length"]},"handles":{"representation":"nonzero_provider_scoped_generation_tagged_u64","create":"caller_owns","close":"idempotent_invalidates_children","drop":"closes_unclosed_owned","validation":["provider","kind","generation","open"],"invalid":"fail_closed_without_dispatch"},"buffers":{"text":"utf8_explicit_byte_length","ownership":{"borrowed_call":"valid_until_call_returns","borrowed_event":"valid_until_event_acknowledged","owned_provider":"released_by_negotiated_release"},"retention":"forbidden_after_boundary","limits":"validated_before_allocation_or_copy","safe_return":"copy_then_release_or_release_on_failure"},"operations":{"capability":"declared_and_checked_before_dispatch","effects":"mapped_to_provider_call","cancellation":"token_then_drain_acknowledge_before_teardown","events":"synchronous_acknowledged_only_v1","fault":"quarantine_provider_invalidate_handles"},"errors":{"shape":["kind","operation","provider_identity","message"],"kinds":["incompatible_version","missing_symbol","feature_denied","trust_denied","invalid_handle","invalid_buffer","capability_denied","cancelled","provider_fault","provider_leak"]},"loading":{"selection":"target_policy_explicit_candidate","trust":"target_signature_or_trust_policy_required","search_paths":{"host_default":"denied","relative":"denied","ambient_lookup":"denied","unsigned":"denied"},"resolution":"required_symbols_before_provider_code"},"audit":{"fields":["provider_identity","operation_class","capability","decision"],"forbidden":["buffer_contents","text_contents","paths","credentials","addresses","raw_handles"]},"fixtures":[{"id":"c-reference-descriptor-provider","kind":"positive"},{"id":"version-incompatible","kind":"negative"},{"id":"missing-symbol","kind":"negative"},{"id":"untrusted-library","kind":"negative"},{"id":"capability-denied","kind":"negative"},{"id":"null-invalid-stale-handle","kind":"negative"},{"id":"borrowed-buffer-retention","kind":"negative"},{"id":"provider-fault-quarantine","kind":"fault"},{"id":"owned-buffer-release-leak","kind":"leak"},{"id":"cancel-drain","kind":"negative"}]}
